{
  "schema_version": "1.0.0",
  "feature_id": "naming-clearance-and-research-registry",
  "record_id": "RES-STUDY-NAMING-001",
  "version": "1.0.0",
  "name": "Testament",
  "searched_at": "2026-08-21",
  "searches": [
    {
      "id": "NAME-TRADEMARK-US-001",
      "class": "trademark",
      "query": "USPTO Wordmark search for TESTAMENT",
      "publisher": "United States Patent and Trademark Office",
      "title": "Trademark search",
      "source_url": "https://tmsearch.uspto.gov/search/search-results",
      "accessed_at": "2026-08-21",
      "result": "unresolved",
      "observation": "The official search interface loaded and accepted the TESTAMENT wordmark query, but its protected result service did not return a result set to the anonymous research browser.",
      "inference": "No conclusion about live or pending United States marks can be drawn from this run.",
      "residual_risk": "High. A qualified trademark search covering relevant classes and similar marks remains necessary before a filing, commercial launch, or claim of clearance."
    },
    {
      "id": "NAME-TRADEMARK-GLOBAL-001",
      "class": "trademark",
      "query": "WIPO Global Brand Database quick search for TESTAMENT",
      "publisher": "World Intellectual Property Organization",
      "title": "Global Brand Database quick search",
      "source_url": "https://branddb.wipo.int/en/quicksearch",
      "accessed_at": "2026-08-21",
      "result": "unresolved",
      "observation": "The official database displayed a maintenance notice, but the anonymous research browser could not obtain a query result set.",
      "inference": "This run does not establish availability in Madrid System or participating national collections.",
      "residual_risk": "High. International and jurisdiction-specific review remains open."
    },
    {
      "id": "NAME-PACKAGE-NPM-001",
      "class": "package",
      "query": "Exact npm package name testament",
      "publisher": "npm, Inc.",
      "title": "npm registry document for testament",
      "source_url": "https://registry.npmjs.org/testament",
      "accessed_at": "2026-08-21",
      "result": "collision",
      "observation": "The exact unscoped package name testament exists. The registry reports latest version 0.2.0 and describes an unrelated Mocha and RequireJS test server.",
      "inference": "Testament cannot publish an unscoped npm package under the exact name without control of the existing package.",
      "residual_risk": "Medium. Use an organization scope for any future npm package and avoid implying affiliation with the existing package."
    },
    {
      "id": "NAME-PACKAGE-PYPI-001",
      "class": "package",
      "query": "Exact PyPI project name testament",
      "publisher": "Python Software Foundation",
      "title": "PyPI JSON project endpoint for testament",
      "source_url": "https://pypi.org/pypi/testament/json",
      "accessed_at": "2026-08-21",
      "result": "clear",
      "observation": "The exact project endpoint returned a Not Found response.",
      "inference": "No exact PyPI project was published at the time of access. This is not a reservation.",
      "residual_risk": "Medium. Availability can change, and package-name availability is not trademark clearance."
    },
    {
      "id": "NAME-PACKAGE-CRATES-001",
      "class": "package",
      "query": "Exact crates.io crate name testament",
      "publisher": "Rust Foundation",
      "title": "crates.io API record for testament",
      "source_url": "https://crates.io/api/v1/crates/testament",
      "accessed_at": "2026-08-21",
      "result": "clear",
      "observation": "The exact crate endpoint reported that crate testament does not exist.",
      "inference": "No exact crates.io crate was published at the time of access. The related git-testament name still exists and the result is not a reservation.",
      "residual_risk": "Medium. Recheck before publication and do not treat package availability as legal clearance."
    },
    {
      "id": "NAME-REPOSITORY-GITHUB-001",
      "class": "repository",
      "query": "Exact GitHub repository names containing /testament",
      "publisher": "GitHub, Inc.",
      "title": "GitHub repository metadata",
      "source_url": "https://api.github.com/repos/jergason/testament",
      "accessed_at": "2026-08-21",
      "result": "collision",
      "observation": "The public jergason/testament repository exists and is unrelated. Factory-AI/testament also exists as the project's public repository. An anonymous global search was rate-limited, so this is not an exhaustive repository-name count.",
      "inference": "The repository basename is shared. The qualified Factory-AI/testament name is controlled by this project, but the bare name is not unique in the software ecosystem.",
      "residual_risk": "Medium. Always use the qualified organization and repository name where ambiguity matters."
    },
    {
      "id": "NAME-DOMAIN-DEV-001",
      "class": "domain",
      "query": "RDAP lookup for testament.dev",
      "publisher": "Google Registry",
      "title": "RDAP domain record for testament.dev",
      "source_url": "https://pubapi.registry.google/rdap/domain/testament.dev",
      "accessed_at": "2026-08-21",
      "result": "collision",
      "observation": "The registry RDAP response reports testament.dev as registered since 2023 with an expiry in 2027.",
      "inference": "The project does not control the obvious .dev domain based on this record.",
      "residual_risk": "High. Do not use testament.dev as a schema authority, website claim, or project-controlled identifier unless ownership is separately verified."
    },
    {
      "id": "NAME-DOMAIN-COM-001",
      "class": "domain",
      "query": "RDAP lookup for testament.com",
      "publisher": "Verisign",
      "title": "RDAP domain record for testament.com",
      "source_url": "https://rdap.verisign.com/com/v1/domain/testament.com",
      "accessed_at": "2026-08-21",
      "result": "collision",
      "observation": "The registry RDAP response reports TESTAMENT.COM as registered since 1997 with an expiry in 2027.",
      "inference": "The project does not control the obvious .com domain based on this record.",
      "residual_risk": "High. Do not imply control, affiliation, or availability."
    },
    {
      "id": "NAME-DOMAIN-ORG-001",
      "class": "domain",
      "query": "RDAP lookup for testament.org",
      "publisher": "Public Interest Registry",
      "title": "RDAP domain record for testament.org",
      "source_url": "https://rdap.publicinterestregistry.org/rdap/domain/testament.org",
      "accessed_at": "2026-08-21",
      "result": "collision",
      "observation": "The registry RDAP response reports testament.org as registered since 1997 with an expiry in 2036.",
      "inference": "The project does not control the obvious .org domain based on this record.",
      "residual_risk": "High. Public navigation must use a domain that the project has independently verified it controls."
    },
    {
      "id": "NAME-STANDARDS-IETF-001",
      "class": "standards-ecosystem",
      "query": "IETF Datatracker document name/title search for testament with RFCs and active drafts",
      "publisher": "Internet Engineering Task Force",
      "title": "IETF Datatracker document search",
      "source_url": "https://datatracker.ietf.org/doc/search/?name=testament&rfcs=on&activedrafts=on",
      "accessed_at": "2026-08-21",
      "result": "clear",
      "observation": "The Datatracker returned no matching active drafts or RFC documents.",
      "inference": "No exact IETF document name was found. This does not search every standards body, working group, mailing list, or implementation.",
      "residual_risk": "Medium. Standards-ecosystem confusion outside the IETF remains possible."
    },
    {
      "id": "NAME-SIMILARITY-MEDIA-001",
      "class": "confusing-similarity",
      "query": "Exact Testament product and character use",
      "publisher": "Arc System Works",
      "title": "Guilty Gear Strive character: Testament",
      "source_url": "https://www.guiltygear.com/ggst/en/character/tst/",
      "accessed_at": "2026-08-21",
      "result": "collision",
      "observation": "Arc System Works uses Testament as the name of a Guilty Gear character and downloadable game product.",
      "inference": "The word has prominent entertainment use outside software infrastructure. The goods and context differ, but search and social ambiguity remain.",
      "residual_risk": "Medium. Avoid game imagery, typography, character references, or copy that could suggest affiliation."
    }
  ],
  "review": {
    "reviewer": "factory-droid[bot]",
    "role": "research worker; not trademark counsel",
    "status": "completed",
    "reviewed_at": "2026-08-21",
    "finding": "The record supports continued limited use of the qualified project name, not a claim of trademark clearance. Official trademark searches remain unresolved, exact npm and common domain names collide, and the bare name is not unique."
  },
  "approval": {
    "status": "conditionally-approved",
    "authority": "Eno Reyes (@enoreyes), lead maintainer",
    "decided_at": "2026-08-21",
    "basis": "Public foundation commit 7c468336954921d2bb319bac3f52a7dc46d9ed4c created Factory-AI/testament and established Testament as the chartered project name.",
    "scope": "Use of Testament and Factory-AI/testament for this public open-source research repository only.",
    "conditions": [
      "Do not describe this record as legal advice, a freedom-to-operate opinion, a trademark registration, or unconditional clearance.",
      "Do not publish an unscoped npm package named testament.",
      "Do not claim or use testament.com, testament.org, or testament.dev as project-controlled domains.",
      "Reopen naming review before commercial launch, trademark filing, domain adoption, or expansion into a new distribution ecosystem."
    ]
  },